328	what form of currency does china have
329	who plays kenneth
330	what league are the indianapolis colts in
331	what country did magellan represent
332	where is perpignan located
333	who did kim richards marry
334	what happened in bosnia in the 90s
335	when 's the last time the steelers won the superbowl
336	where english is spoken
337	where is giza pyramids located
338	what is the zip code for midland tx
339	what states make up the midwest us
340	what instruments does justin bieber use
341	what language does australians speak
342	who did annie oakley married
343	who has played lex luthor
344	where does the zambezi river start
345	what is the nigeria time
346	where did they find jenni rivera 's body
347	what university did romney graduated from
348	where is the time zone line in south dakota
349	where is jason mraz from
350	what killed john bonham
351	what industry does walmart operate in
352	what county is texarkana arkansas in
353	what music period did beethoven live in
354	what did laura ingalls wilder wrote
355	what type of government system does italy have
356	what did john irving wrote
357	what is the national flower of hawaii
358	what did alice paul accomplish
359	what languages do they speak in costa rica
360	where did hank marvin come from
361	when did chipper jones get drafted
362	what part did winona ryder play in star trek
363	where did jovan belcher kill himself
364	where did clay matthews go to school
365	what time is it in texas houston right now
366	who is princess leia in star wars
367	what is the political structure of china
368	what is new york city airport
369	what language brazil speak
370	who played obi wan in episode 2
371	where did venus williams come from
372	what currency is used in panama
373	where does the zambezi river originate
374	what team did ronaldo play for in 2003
375	where does robin williams live 2011
376	who played jacob black in twilight
377	when was president john adams elected
378	which airport to fly into in buenos aires
379	what team did adrian peterson play for in college
380	where does name pennsylvania come from
381	what kind of money do they use in germany
382	who plays blaine in batman
383	what language does australia use
384	who did veronica lake mary
385	who did sir francis drake marry
386	who plays stephanie plum in one for the money
387	what did the ancient romans speak
388	what does ringo sing
389	where was st. lucy born
390	what type of government does australia have
391	who was the father of king george vi
392	what is the zip code for trenton
393	what has ashley greene been in
394	where did al qaeda attack
395	what language is spoken in switzerland
396	who was philip in acts chapter 8
397	what the time zone in england
398	what is the best currency to take to turkey
399	what system of government is practiced in nigeria
400	who were mary shelley
401	what language do most australians speak
402	where is denmark situated
403	where was teddy roosevelt 's house
404	what is the government system of malaysia
405	what do people speak in canada
406	what type of money do they use in costa rica
407	what timezone is nashville tn
408	who was anakin skywalker
409	where did adolf hitler die
410	what is the largest nation in europe
411	where was the first gulf war fought
412	who are the senators of virginia 2013
413	what band was george clinton in
414	what country borders slovakia
415	what was james garfield most known for
416	where did paula deen go to school
417	where does robert irvine come from
418	what style of music does michael jackson perform
419	what does david beckham play
420	what does julian lennon do
421	what is the milwaukee brewers mascot
422	what is the second biggest state in the united states
423	what has charlie hunnam been in
424	what are all the movies taylor swift has been in
425	what college did brett favre
426	where did alex chilton die
427	what college did martin luther king jr go to
428	what kind of cancer did farrah fawcett die of
429	who is michael j fox 's wife
430	what money do i use in costa rica
431	what guitar did joe walsh play
432	what are the official languages of the eu
433	what is ryan seacrest radio show
434	what language do most italians speak
435	what money do they use in spain
436	what did drew barrymore go to rehab for
437	when is saint george day celebrated
438	what government did the roman empire have
439	what instrument did robin gibb play
440	who voiced darth vader
441	when was abe lincoln president
442	where are the texas rangers playing
443	what is arkansas state capitol
444	what is the zip code for nogales az
445	when did michael vick start playing for the eagles
446	what is william taft famous for
447	where did robin cook die
448	where did melba beals live
449	who is louisiana state senator
450	what are the 7 countries that are part of central america
451	where did derek fisher go to college
452	who was kobe bryant drafted by
453	where are the new orleans hornets moving to
454	what language does algerian people speak
455	where was anne boleyn executed
456	what did galileo do to become famous
457	what school did martin luther king jr received his doctorate degree from
458	where buddha come from
459	what did king henry viii rule
460	what type of cancer did larry hagman have
461	what wars did robert e lee served in
462	what russian language called
463	who is in charge of libya now
464	when did shays rebellion start
465	what kind of disease does montel williams have
466	when is the last time the ravens won a superbowl
467	where did kansas city royals come from
468	what style of music does john mayer play
469	what inventions did thomas edison invent list
470	where did djokovic come from
471	what part of the country is new england
472	what money to take to turkey
473	what kind of music did jimi hendrix play
474	what degrees did obama get in college
475	who were alexander graham bell 's siblings
476	when did liverpool fc last win the champions league
477	who played jeannie
478	where was st peter killed
479	who does jeremy shockey play for in 2012
480	what college did deion sanders jr go to
481	when did the battle of alamo start
482	what were the names of henry viii 's three children
483	what was queen elizabeth ii childhood nickname
484	where did tim tebow grow up
485	where is chesapeake bay bridge
486	who played victoria barkley
487	where did kennedy 's inaugural address take place
488	what countries have german as the official language
489	where did the taliban began
490	who plays elena gilbert on vampire diaries
491	what does the missouri river bisect
