200	what is the share of agriculture in indian economy
201	who sings the song it ain't me
202	when does the nba season end this year
203	what us president is the only president to become an eagle scout
204	when was the drinking age set to 21
205	method used by a writer to develop a character
206	when is the womens ice skating for the olympics
207	what position did doug peterson play in the nfl
208	who played lionel in as time goes by
209	how many co2 molecules are produced in aerobic respiration
210	where does the optic nerve cross the midline ​
211	the grand tour season 2 episode 2 celebrity guests
212	who was toot toot in the green mile
213	what is billy last name in where the red fern grows
214	who painted the ceiling of the florence cathedral
215	who sings too much time on my hands lyrics
216	who has hosted the most fifa world cups
217	which is the lion's mane jellyfish's species within its genus
218	who was the buccaneers qb when they won the superbowl
219	who did the central powers defeat on the eastern front before concentrating back on france
220	what kind of fish live in the salton sea
221	when was the defensive 3 second rule implemented
222	when did jack mccoy join law and order
223	who did the music for your lie in april
224	who died in the first episode of stranger things
225	who are the characters in yo gabba gabba
226	who was the captain of the mayflower when it took the pilgrims to the new world
227	who won the national championship in volleyball 2017
228	name a food you might eat on thanksgiving
229	when is the next episode of flash airing
230	what is the longest pier in the uk
231	who did cora marry in once upon a time
232	what nfl team is robert griffin the third playing for
233	who owns the dower house in the archers
234	who sings that aint no way to go
235	who beat university of virginia in basketball this year
236	what is the 3rd largest state in usa
237	who sings why does it hurt when i pee
238	when does the cannes film festival take place
239	panic at the disco song about a wedding
240	how many episodes of corrie has there been
241	who is the voice of the other mother in coraline
242	how many tornado planes does the uk have
243	how many strong verbs are there in german
244	who sings tie a yellow ribbon around the old oak tree
245	where does patience is a virtue come from
246	which country has the smallest population in europe
247	who plays elsa's aunt in once upon a time
248	where was held the first session of muslim league
249	what is the name of the dragon in eragon
250	points outside the production possibilities curve represent combinations of products that are
251	what is the largest magnitude earthquake that has occurred in the pacific northwest
252	when does the champions league quarter finals start
253	when will the flash season 4 episode 17 come out
254	when was the last summer olympics in the usa
255	who is the head a in pretty little liars
256	when did the term sustainability start to be used
257	where was the killing of a sacred deer filmed
258	how much energy does coal produce in the us
259	who was the killer in the movie i know what you did last summer
260	who played susanna in legends of the fall
261	what new deal program limited production in industry
262	fast & furious 8 release date in india
263	the group that officially elects the president of the united states is called
264	who played adaline in the age of adaline
265	who played raquel in only fools and horses
266	who was elected governor of tennessee in 1865
267	what type of political system does el salvador have
268	when was the last time.michigan beat ohio state
269	when did they stop making pull tabs on beer cans
270	what is the poorest county in the state of florida
271	when was the last time arsenal win premier league
272	when does the movie jeepers creepers come out
273	when did how you remind me come out
274	the joint between a coxal bone of the pelvis and the sacrum
275	what is the song in red dead redemption
276	who played cosette in les miserables on broadway
277	when did stephen curry won the mvp award
278	who ran the fastest 40 yard dash in the nfl
279	whats the difference between tomato paste and tomato puree
280	what type of plate boundary is associated with iceland and its volcanic eruptions
281	who plays jimmy's mom in 8 mile
282	who is the presiding officer of legislative council in india
283	when was son of a preacher man released
284	when did the first train run in england
285	when did the united kingdom entered world war 2
286	actress who plays brad pitts wife in war machine
287	who invented the cornell method of note taking
288	who sings will you still love me when i'm not young and beautiful
289	when did world war 2 officially start and end
290	who wrote the song mary had a little lamb
291	factories that assemble parts made in other countries
292	who is the book of galatians written to
293	what type of song is what a wonderful world
294	which is the first private medical college in kerala
295	tujhe dekha toh yeh jana sanam movie name
296	who wrote antigone and what are the dates of his birth and death
297	when was i look at the world poem written
298	what is the name of the hyena in lion king
299	where does the white witch live in narnia
