300	who kills barry's mom in the flash
301	who is the book of acts written to
302	what is the meaning of the name gomez
303	how long have we been celebrating pi day
304	who won the mvp for the national league
305	who is the actor that plays ducky on ncis
306	when does the new death of superman come out
307	who started the state of the union address
308	when was a series of unfortunate events published
309	when is the last time the vikings were in the nfc championship
310	who produced a change is gonna come
311	how long are the episodes in stranger things season 1
312	where will the first round of march madness be played
313	when did fortnite battle royal come out on xbox
314	who was the first baseball player to be featured on a postage stamp
315	when did movies start coming out in color
316	when does sam realize he is jim in ghost whisperer
317	who wrote knock knock knocking on heavens door
318	who plays stacey's mum in gavin and stacey
319	when did amnesia the dark descent come out
320	what nfl player has the most nfl rings
321	where is this years army navy game played
322	dendrites and cell bodies are components of what type of matter found in the brain
323	how long is the famous suspension bridge in san francisco and what is it called
324	who sings i want to dance with you
325	who sings song at the end of beauty and the beast
326	what is an example of a government monopoly in the united states
327	who sang the song you got a friend in me
328	where does a wrinkle in time take place
329	what are the main functions of the stem
330	who said the poison is in the dose
331	the outer layer of the skin that contains no blood or nerve supply is the
332	what year did seven nation army come out
333	what episode does marnie come back in geordie shore
334	who played in the first fifty shades of grey
335	how many episodes in season 3 of good witch
336	when did canada get rid of the death penalty
337	who conducted the opening concert at carnegie hall
338	host of the late show who was once a correspondent for the daily show
339	where did students for a democratic society start
340	when did we first put a rover on mars
341	when was last time bayern munich won champions league
342	what genre is the magic tree house books
343	who laid foundation stone of islamia college peshawar
344	who wrote the song city of new orleans
345	who became king of erebor after thorin dies
346	who won the ncaa women's championship last year 2017
347	who plays the mouse in alice in wonderland
348	who did us fight in world war 1
349	rain sleet or snow that contains a high concentration of acids is called
350	who plays jack skellington in nightmare before christmas
351	who was the head of the spanish inquisition
352	when did the movie peter pan come out
353	what ethnic group celebrates its contribution to america in october
354	make it or break it who goes to the olympics
355	element named after fictional planet from which superman came
356	who plays red on orange is new black
357	where was the movie i am number 4 filmed
358	another name for the torso is the blank region of the body
359	where does blood go when it leaves the pulmonary artery
360	who were the bands in pitch perfect 3
361	who has the most yards per carry in nfl history
362	who commissioned the first christmas card in 1943
363	when did they start adding zinc to pennies
364	who was hope brady's mother on days of our lives
365	what is the title of the person who runs the house of representatives
366	who has been designed as the new finance secretary of india
367	who plays the first nfl game of the season
368	who won last year's ncaa women's basketball
369	what is the most popular religion in sweden
370	who is the current defence against the dark arts teacher
371	who decides where the super bowl is played
372	where was the last scene of the danish girl filmed
373	what does g stand for in ncis los angeles
374	cls bank deals with transactions arising out of
375	who is in charge of ratifying treaties in the us
376	where was the hindenburg scheduled to fly and how many passengers were on it
377	days of our lives cast doug and julie
378	who sang i'm gonna run away from you
379	who plays whitey bulger's girlfriend in black mass
380	who came up with popcorn at the movies
381	what are the two extracellular fluid compartments in the body
382	what emperor took over france after the reign of terror
383	how many episodes of touching evil are there
384	what was the result of the revolt of 1857
385	who sang the song a white sports coat and a pink carnation
386	cast of the have and have nots play
387	who wrote shes always a woman to me
388	what is the largest city in the united states per square mile
389	when was the last time the vikings made the superbowl
390	where does new crust come from in sea floor spreading
391	where was the first high level language operating system created
392	who played shaggy in the new scooby doo movie
393	what is the ultimate objective of financial management
394	how many times have real madrid won the champions league in a row
395	which animal on earth has the longest life span
396	where do you get a cashiers check from
397	how many episodes in great british bake off 2017
398	who played guitar on my guitar gently weeps
399	what state does rick and morty take place in
