500	three largest cities in the world by population
501	where is south pole located on a map
502	prior to 1948 north and south vietnam were a part of
503	wal-mart is a prime example of which type organization
504	where do the florida marlins have spring training
505	when does star trek discovery season 1 end
506	who is the director of nightmare before christmas
507	how many episodes is ash vs evil dead season 3
508	when was the term social justice first used
509	big bang theory season 11 how many episodes
510	when did it become law to stand for the national anthem
511	who has the most international goals of all time
512	how many gold medals won by india in 2018 commonwealth games
513	who changed the role of the first lady
514	who is the best director in bollywood 2017
515	what is the word for clarified butter in the balkans and middle east
516	who played the girl in silence of the lambs
517	what is the name of the compound p4010
518	what is a home run with a girl
519	who owns spirit of the suwannee music park
520	who invented the first home video security system
521	when will the 2018 oscar nominations be announced
522	when is the new dumping ground coming out 2017
523	who is under the mask of darth vader
524	who plays justin on the haves and the have nots
525	who was the qb for the saints before drew brees
526	when was harry potter and the philosophers stone published
527	who is the father of genetics and what did he study
528	who played the judge in good will hunting
529	what state did they film daddy's home 2
530	where was the first session of the assam association held in1905
531	who proved that cells come from other cells
532	who sang the song with reba does he love you
533	referring to the organs of reproduction is called
534	what is the source of information for account receivables
535	who sings the song i'll never forget you
536	skin that covers the palms fingertips and soles of the feet
537	who dies in the lost city of z
538	where do the astros play for spring training
539	when was the last time oklahoma won a national championship in football
540	who sang it my party and i'll cry if i want to in the 80
541	when was the last time dallas cowboys won the super bowl
542	where does hydrogen peroxide come from in the body
543	legislation regarding data protection and security in uk
544	where does the eurostar train arrives in london
545	what is the main religion in british columbia
546	krypton-85 decays by emission of a beta particle. the product of this decay is
547	who sings every light in the house is on
548	who was the leader of the soviet union when the berlin wall was built
549	how many stores does lowes have in canada
550	who developed the central processing unit (cpu)
551	what is a another name for the water cycle
552	what is the biggest determinant of climate in venezuela
553	who invented the printing press and in what year
554	who plays the queen in victoria and abdul
555	where is the hotel used in the movie the shining
556	where in the bible are the 12 disciples
557	who is the first indian woman to be canonized as a saint
558	what is the meaning of the harp in ireland
559	what is the origin of the word celsius
560	who plays lindsay denton in line of duty
561	when was hitchhiker's guide to the galaxy made
562	what is the full form of cfc's
563	when does madea's family funeral come out
564	who is the team that beat the eagles this season
565	who plays kevins shrink on kevin probably saves the world
566	who won the battle of saratoga in 1777
567	lilo and stitch the series season 1 episode 1
568	when does dragon ball super episode 130 comes out
569	where does the name loyola university come from
570	when does season 8 of shameless come back
571	who is playing halftime show super bowl 50
572	the assassination of gianni versace american crime story season 2 episode 2
573	where do rory and paris go to college
574	who was the winner of the first indianapolis 500
575	when did the united states acquired puerto rico
576	who is jared on the bold and the beautiful
577	who does the voice of mickey mouse on mickey mouse clubhouse
578	which episode does gideon die in criminal minds
579	batman the enemy with episode 5 release date
580	what does the ghost of christmas present sprinkle from his torch
581	who won the 2018 women's royal rumble match
582	where was part of the classic surfing movie endless summer filmed
583	who was the first woman to win who wants to be a millionaire
584	who won in the brown vs board of education case
585	who are nominated for president of india 2017
586	who wrote he ain't heavy he's my brother lyrics
587	when was the lupus foundation of america founded
588	who drafted the document of the un declaration of human rights
589	aphasia is a term defining difficulty or loss of ability to
590	who plays alec ramsay in the black stallion
591	who wrote you must have been a beautiful baby
592	which is the default file extension for an audio file in windows media player
593	when was rosencrantz and guildenstern are dead written
594	who plays connor's mom in madeas christmas
595	hazels boyfriend in the fault in our stars
596	who has won the most games in nfl 2017
597	when did italy enter the second world war
598	who drives the number 95 car in nascar
599	i was a great islamic scholar and mathematician who died in 1131 ce
