700	what was the religion in persia before islam
701	why does kerosene oil rise up in the wick of lantern
702	mention the chemical change that proinsulin undergo to be able to act as mature insulin
703	where does the sweetness of fruit come from
704	an object that moves around an external axis is said to be
705	what was the name of the plant on little shop of horrors
706	who signed the declaration of independence for maryland
707	when does wonder woman come out on blue ray
708	what nba team did derrick rose play for
709	where did the term liberal arts come from
710	who heads the executive department of west virginia government
711	how long is the bridge between new brunswick and prince edward island
712	when did the uk and us become allies
713	who sang the theme song for the man with the golden gun
714	american horror story freak show girl kidnapped by clown
715	the probability of making a type i error when retaining ho at the .05 level of significance is
716	what year did the us hockey team won the olympics
717	who wrote it's a long long way to pasadena
718	who wrote the song i hate you i love you
719	what is loihi and where does it originate from
720	who rebuilt the temple after the babylonian captivity
721	who was executed for being an american spy during the revolutionary war
722	who sang the song suddenly with olivia newton john
723	who is command sergeant major of the army
724	who sings the original windmills of your mind
725	where will the next summer and winter olympics be held
726	when did ole miss beat alabama in football
727	who sang the song how far is heaven
728	where are the organ mountains in new mexico
729	where are the 10 plagues found in the bible
730	where are red blood cells made in adults
731	who was the pinkerton detective agency's first female detective
732	how many episodes are there in modern family
733	who built the first temple for god in jerusalem
734	what is a dropped pin on google maps for
735	what do the 3 dots mean in math
736	who wrote the song photograph by ringo starr
737	who is playing the halftime show at super bowl 2016
738	to aru kagaku no railgun s episode 3
739	who won the 2017 sports personality of the year
740	where was the world economic forum held this year
741	where are the giant redwoods located in california
742	who has made the most premier league appearances
743	who was the first chief minister of west bengal
744	who sings got my mind set on you
745	two main types of research methods used in psychology
746	who plays peter in what we do in the shadows
747	when does the 14th season of grey's anatomy come out
748	when was the first hunger games book published
749	how much is the united states in debt to china
750	where did the race in grease take place
751	what is the maximum data rate for the 802.11a standard select one
752	a good that can be used in place of another good
753	where in the bible can i find the lord's prayer
754	when was the last time nebraska voted democrat
755	who become the ceo of it wipro company in 2016
756	who does eric end up with in gossip girl
757	who plays unis in she's the man
758	who played booster in jingle all the way
759	who is recognized as the founder of islam
760	who plays emma in air bud world pup
761	how old was sasuke when his clan died
762	where do some of the natural air pollutants come from
763	who is the pastor of new birth missionary baptist church now
764	who is doing 2018 super bowl half time show
765	who is playing the halftime show for the superbowl
766	who hosted they think it's all over
767	where does the movie proof of life take place
768	where does us highway 1 start and end
769	who scored the most points in a single game in the nba
770	where is natural gas found in the us
771	when were the first general elections held in independent india
772	what was the tower of london originally used for
773	what type of fuel goes in a zippo
774	first jnanpith award was an autor of which language
775	who played the mad hatter in the batman tv show
776	how many cracker barrels in the united states
777	in photosynthesis the carbon in co2 is initially fixed to what molecule
778	who voices randy in f is for family
779	how many countries does cadbury sell its products
780	ethiopia flight 961 crashes in to the sea
781	what does istj mean in a personality test
782	who does the voice of ash in sing
783	who scored the most points in their nba career
784	with a land area of 54 314 square miles where does wisconsin rank among the 50 states
785	who plays charles on have and have nots
786	who wrote the book my country my life
787	when did the east india company take control of india
788	where does the water come from to fill lake eyre
789	who is the founder of google and when was it founded
790	who did the dominican republic gain its independence from
791	how did early humans make use of stones during the prehistoric period
792	who wrote the text for jeanie with the light brown hair
793	the basic steps of rational decision making include defining goals and
794	when was the design period known as art deco
795	where does the bob and tom show broadcast from
796	star wars the clone wars season 3 episode 1
797	what part of brain is responsible for complex thinking
798	who won the champions league final in 2016
799	who has the most gold medals in the winter olympics of all time
