800	where was the movie strangers prey at night filmed
801	what order do the captain america movies go in
802	when was i don't like mondays released
803	what does the sun represent on the uruguay flag
804	who dies in season 2 of the originals
805	when did beryl markham fly across the atlantic
806	who played john clark sr on nypd blue
807	what does the pearl symbolize in the bible
808	when did the song here comes the boom come out
809	does archie end up with betty or veronica in riverdale
810	who wrote most of the declaration of independance
811	who does brant daugherty play in pretty little liars
812	who played amy grant i i can only imagine
813	who played the villain in tiger zinda hai
814	when did under the cork tree come out
815	when did korea separate into north and south
816	who discovered the atom and in what year
817	creating appropriation bills falls under which power of congress
818	who sings the song let me love you
819	how many seasons are there for lost girl
820	who is the leading african producer of wool
821	where was the first nhl hockey game played
822	how many inches is the iphone 5s screen
823	where do the signals for apoptosis come from
824	who made delhi as capital for the first time
825	what was the first capital city of australia
826	who won the womens 2017 ncaa basketball tournament
827	how many episodes of ray donovan series 3 are there
828	when does canada switch to daylight savings time
829	where does jack ryan live in patriot games
830	who gave the famous objective co relative theory
831	what is the meaning of the name mandy
832	what happened to the actor who played frost on rizzoli and isles
833	which domain of life are humans members of
834	when is the new jurassic world game coming out
835	what was the alliance between great britian russia and france known as
836	when was the death penalty reinstated in oregon
837	what was icq as related to instant messaging
838	when does season 3 of the riveras start
839	chandra and bhaga river meets at the place
840	who took part in the american civil war
841	when was the national flag of india adopted
842	what was the most important new religious figure of the new kingdom of ancient egypt
843	who is often associated with printing the first book using moveable type in germany
844	when does the sa node begin electrical signaling
845	who are the artists in the traveling wilburys
846	who plays artemisia in 300 rise of an empire
847	who is the most played artist on spotify
848	which term describes the replacement of damaged cells to mend a tissue
849	where are haploid cells found in the human body
850	form from material that has accumulated on the earths surface
851	when is the last time the new york giants won the super bowl
852	nickname given to railroad executives due to shady practices of their businesses
853	who is young george bailey in it's a wonderful life
854	who won the battle of stirling bridge 1297
855	who plays dylan in daddy's home 2
856	where is the tablet of the ten commandments
857	when did the right to buy scheme start
858	who issued gold coins for the first time in india
859	how many players have scored 10000 runs in odi
860	what do mobile numbers start with in the uk
861	who has won the most f1 grand prix
862	who is the present rajya sabha speaker of india
863	latest series of keeping up with the kardashians
864	who plays meredith quill in guardians of the galaxy 2
865	who is the guy on keeping up with the kardashians
866	who has the most catches in nfl history
867	locations for the film an englishman who went up a hill
868	when did bihar bifurcate from bengal and some parts of chota nagpur merged into bengal
869	when was the last time mount ruapehu erupted
870	where was 2017 beauty and the beast filmed
871	what proposition made the insurance commissioner an elected position
872	where is the 7th game of the world series played
873	who is the valley of the dolls based on
874	who was the actor who played crocodile dundee
875	where are trigger points located in the body
876	who bowled the last over of the 2007 world twenty20 that india won
877	who was the ottoman governor who led egypt in the years following the napoleonic wars
878	what role does the president play in foreign affairs
879	who hit 6 sixes in an over in test cricket
880	how long has it been since eagles went to super bowl
881	who did the united states win its independence from
882	who won season 8 of america's next top model
883	who was an early advocate for using scientific methods based on inductive reasoning
884	the first political society started under british rule in india was
885	what is an example of a tricyclic antidepressant
886	who won mark and goal of the year 2017
887	who will get ticket to finale in rising star 2
888	when's the last time philly won the superbowl
889	where does the term pop music come from
890	who became the king of ayodhya after ram
891	what is the most famous building in rennes
892	when did equus first appear in fossil record
893	where was percy jackson and the olympians filmed
894	when was the last amendment to the constitution passed
895	sending money home to the native country is an example of
896	how many points did lebron james scored in his career
897	who was charlie writing to in perks of being a wallflower movie
898	who won the men's single title of australia open on 1 february 2015
899	who played mr. willoughby in sense and sensibility
