100	What was something that Saipa manufactured?
101	Cite all the choral symphonies?
102	Who is a Guamanian citizen?
103	What movie did Syncopy Inc. produce with Christopher Nolan as the screenwriter?
104	What are the objects that were designed by Joan Daemen?
105	What aircraft was created by John Cyril Porte?
106	Which individual works at Julliard and was a Manhattan School of Music alumnus?
107	Which properties are maintained by Bridge House Estates?
108	Ethan Coen produced what Joel Coen directed film?
109	DeVery Freeman was the screenwriter of a movie that was composed by who?
110	Who won a Tysin Holly Farms 400 competition?
111	Where were persons that held the position Dean of Norwich educated at?
112	Which film was directed and produced by Christopher Nolan?
113	Who graduated from Stuyvesant High School and Brooklyn Law School?
114	What are some notable diamonds ?
115	What is the name of the South Dakotan radio station licensed in Watertown?
116	What Russian cities and towns are located in Komi Republic?
117	Which competitions did both Liverpool F.C. and West Ham United F.C. participate in?
118	What feature of geography can be found in or around Runde?
119	What transportation branch was created and is owned by Long Island Rail Road.
120	What are the existing deep fields ?
121	What fictional character had their debut appearance in Star Wars: Episode V – The Empire Strikes Back?
122	Who do employees of JASON work for?
123	Who can be considered a Loyola Law School alumni?
124	Lee Enterprises' newspaper is published in what city?
125	Which competition featured both the LA Dodgers and the Philadelphia Phillies as its participants?
126	Which land mass will you find next to the Gulf of Boothia?
127	What is the call sign of a Michigan radio station whose license is in Saginaw?
128	What are the bridges with a deck height of at least 200 meters ?
129	Who is from Mataram Sultanate?
130	Who directed the piece of media that was produced by the This is that corporation?
131	What services did Vietnam Airlines operate?
132	What city in Sweden is located in the Sandviken municipality?
133	Fitzroy Football Club participated in what competition as the winner?
134	Who was a coach for the LA Galaxy?
135	What work did Randy Cartwright contribute most towards?
136	Which Monaco Grand Prix was won by Michael Schumacher?
137	Who received the English Victoria cross after 1918?
138	Who did Jules Engel teach?
139	Which language is native to Arizona?
140	County Kerry is home to what nonprofit organization?
141	What is a Greensboro, North Carolina-based museum?
142	What piece of literature did the Royal College of Nursing publish?
143	Which film did Red Chillies Entertainment produce?
144	Eskay Movies produced what film?
145	Who directed a TV show/film that was produced by David Parfitt?
146	Which TV show was executive produced by Valentín Pimstein?
147	What story collection did Samuel R. Delany edit?
148	Which musician was the most known student of George Crumb?
149	What is the name of a Tasmanian locality found in the Devonport local government area?
150	Which model of car is made by Lincoln Motors?
151	What city or municipality located in the Philipines are in the Tarlac province? 
152	What are the existing musical chords ?
153	What college was the player by the St Louis Cardinals drafted for?
154	Eidgenoessische Konstruktionswerkstaette manufactured what structures?
155	Which movie did Relativity Media distribute?
156	What train station is Via Rail-owned?
157	What county or geographic entity is next to Lake Okeechobee?
158	Which film that Priyadarshan directed was penned by Sreenivasan?
159	Which automobile is most associated with the Sunbeam brand?
160	What fashion periodicals were launched after 1996?
161	Which item was found in Delphi?
162	What brands are popcorn brands ?
163	Who was one of the climbers in the 1975 British Mt. Everest Southwest Face expedition?
164	What was operating under EDF Energy?
165	What famous Leonese person wrote and spoke the language?
166	What is the names of all Anglican BIshops of Bath and Wells?
167	What movie did John Milius author and direct?
168	In the movie screenwritten by Mae West, who was the director?
169	Who studied under Sarah Robinson-Duff?
170	Charlie Chaplin composed music for which film that he also directed?
171	Which Monaco Grand Prix did Ayrton Senna win?
172	What is a game that id Software released?
173	What is the name of an organization serving the intersex community?
174	The Union Jack can be found on what symbol?
175	Who won a French Grand Prix competition?
176	What kind of building was built in European architecture during the Second Empire?
177	Who is a member of the Pakistan Air Force?
178	Which competition featured both Collingwood Football Club and Carlton Football Club as participants?
179	Who directed the TV show where Mike Scully was screenwriter?
180	Where Jules Engel's students study?
181	What is the call sign of a Missouri radio station whose license is in the city of Poplar Bluff?
182	What individuals who are not in favor of the BDS movement are from Israel?
183	Who directed the films which Nusrat Fateh Ali Khan composed the music for?
184	Victorian Railways manufactured what objects?
185	Who was the coach of Norwich City FC?
186	Who has Nanyuen citizenship?
187	Bryna Productions made what television series?
188	Who was a worker for the state of Nigeria?
189	What motion picture with a score written by Baburaj had P. Bhaskaran credited as director?
190	Where did the White House Deputy Chief of Staff receive their education?
191	In which cities are there famous grand mosques ?
192	Which movie did H. R. Bhargava direct which also had M. Ranga Rao as its musical composer?
193	What is a census designated place in Cumberland County, Maine?
194	What species was discovered in the Paja Formation?
195	What 1975 Malayam film had A. T. Ummer for its musics director?
196	Where Were the Dean of Westminster educated?
197	Which military unit belongs to the EU Battlegroup?
198	Which tall building in Wellington houses offices?
199	What is the name of the Atlus games that were released for the Nintendo 3DS console?
