415	As of August 3rd, 2024, which Moose Jaw Warrior with a retired number was born on May 29, 1967?
416	As of July 2024, which protagonist of a 'shonen jump' series shares a name with a station on a West Japan Railway Company regional line?
417	What's the fifth song on the fifth album of the pop singer who was parodied in the fifth song on "Weird Al" Yankovic's fifth album?
418	I'm thinking of a painting. It was done by the same man who painted The Anti-Slavery Society Convention in the 1840's. The painting is about an election. Can you tell me the name of it?
419	In what year was the former South Korean prime minister who is from the same clan as the oldest member of the band BTS born?
420	What is the birth year of the American President who once pet the cat who was buried at the Hagia Sofia in 2020?
421	There was a popular movie that came out in 2016 starring Emma Stone and Ryan Gosling, tell me where the director of this movie was born.
422	By what amount was the budget of Peter Jackson's King Kong higher than the budget of John Guillermin's version of King Kong?
423	What was the age difference at their deaths (in years) between Edgar Allan Poe and his rival, Rufus Wilmot Griswold, multiplied by 100?
424	How old was the vice president to the fifth US president when he died?
425	Who was the manager for the MLB World Series winning team the year that another team broke the record for the longest consecutive winning streak in a regular season? Base your answer on the following:  -- The team who broke the record did so in the 2010s
426	What award was won in 2003 by the Swiss architecture firm that designed Roche Tower?
427	How many New Zealanders have won Australian Idol during seasons 1 to 8?
428	Who was the mayor of France's 25th President's hometown when they were first elected President?
429	Of the Jason Statham movies that came out the year Dennis Hopper died, which could he have lived to see the premiere of?
430	Whose memoir was co-written with the author of Pill Head: The Secret Life of a Painkiller Addict and published post-humously 2 years after her death?
431	What day of the year do John of Lancaster (Duke of Bedford), Fritz Koenig (German Sculptor), Edith Windsor (LGBT Activist), and Ulf Merbold (German Physicist and Astronaut) all have in common?
432	In 2024's version of the world, which country was the birthplace of the Emperor who reigned from the year 363 to 364 over the Empire that the Goths played a major part in collapsing?
433	Who was Prime Minister in Australia at the same time that Norman Gunston released "Salute to ABBA"?
434	Which one was longer and by how much? James Cameron's film Titanic (1997) or the actual sinking of the Titanic in 1912?
435	I'm thinking of the  screenplay, co-wrote by the same author as Lonesome Dove, that won an Oscar for Best Adapted Screenplay 20 years after Lonesome Dove won the Pulitzer Prize. What was the name of the screenplay?
436	What was the founding name of the company that ran the coal mining camp in the city where baseball great Willie Mays was born?
437	Which original Saturday Night Live cast member's daughter, tied with Hannah Waddingham for the Best Supporting Actress in a Streaming Series, Comedy award at the 1st Hollywood Critics Association TV Awards in 2021?
438	Who was the youngest climber to podium at the first year climbing was in the olympics?
439	As of January 1st, 2024, how many buildings in New York City were 750ft or taller the last time Halley's Comet came close to Earth?
440	What novel by Ernest Hemingway won a Pulitzer prize for fiction that was subsequently overturned twelve years before the same author won again?
441	Who was the successor of the Egyptian Pharaoh that was in power when the Treasury of Atreus was completed?
442	What is the age difference between the youngest and oldest person, in the 20th Century, to win two Nobel Prizes?
443	What season of The Challenge was airing when Bridgeton premiered?
444	How many of Mark Calaway's consecutive Wrestlemania wins occurred in matches that were longer than the final match result in the same year's competition, not including years where Calaway was part of the final result?
445	What number do you get when you add up the numbers in the postcode of the hospital John Lennon was born in?
446	Which set director born in 1936 won the Academy Award for Best Production Design during the 71st Academy Awards?
447	The star of the TV show "The Bear" had his breakout role on a Showtime show. The actress who played his older sister on that Showtime show released an album in 2007. The label who released her album released their first album 27 years previous. From their first album, what number did the title track reach on the Billboard Hot 100?
448	When Taylor Swift first released her studio album "1989," how many studio albums had Katy Perry already released?
449	Who lived longer one of the Bronte sisters or Jane Austen?
450	Who was the head coach of the team that won the Superbowl the year that the show Law & Order: SVU was released?
451	How many times taller is the 7th highest mountain the world than Novake, Poljčane in Slovenia? Round your answer to one decimal place.
452	The Wisconsin Butter Fire led to dams being built to protect a lake that was the site of the plane crash death of which famous musician?
453	What is the English meaning of the name of the smaller of the two constellations which resides in the middle of the Summer Triangle?
454	During the year that Serbia became an independent republic after separation from Montenegro, who won the Nobel Prize for Literature?
455	How many years older is the the library where Galileo's middle finger was first exhibited than the first public library to be lit using electric lightbulbs?
456	If the person who played the joker in "The Dark Knight" (2008) had children, how old will they be on the films 50th anniversary?
457	What was David Fincher's most recently released feature film when Britney Spears' first feature film was released in the U.S.?
458	What was the last album the Grateful Dead released prior to the death of Doors vocalist Jim Morrison?
459	David Fincher has two movies in the 90's that have numbers in the title. What is the number in the title of David Fincher's later-released movie multiplied by the ratio of the sum of all of the molars in an aardvark over the number of adult teeth in a dog?
460	The band Franz Ferdinand is named after Archduke Franz Ferdinand of Austria and a racehorse that the band watched win a race. How many years before the assassination of Archduke Franz Ferdinand was that race established?
461	Which university did the actor who has appeared in the most movies in the American pie film series (including spinoffs, as of 2020) deliver a commencement address at in 2012?
462	Since the turn of the 21st century, there has only been one year in which the Pulitzer Prize for Fiction has not been awarded. Among the finalists that year, one novel was published posthumously. The author of this posthumous publication is best known for a different novel published 15 years prior. The opening lines of this book later inspired a song by a band. The name of this band can be determined with the following calculation: find the age of the author on January 1 of the year the latter book was published, add four, and subtract the sum from the year this author was a Pulitzer Prize finalist. The name of this band was inspired by yet another book. What is the name of this book and its author?
463	How old was Akira Toriyama when Pokemon Diamond and Pearl was released in America?
464	As of 2020, what was the population of the city where Dippin' Dots were founded?
465	How old were the founders of the firm that designed the Empire State Building when construction on the building began?
466	In 2015, Emmanuel Lubezki was cinematographer for a film that was directed by the man who also directed the 2014 film Birdman. What is that film?
467	A puzzle released in the 1970's gained popularity and inspired the establishment of an international speed competition. What was the average time of all winners of this competition between 2005 and 2015 rounded to the nearest 100th?
468	Who was the British Prime Minister in the year that the Glastonbury Festival was launched?
469	Which South Korean Cross-country skier had the highest rank at the Olympics in the Men's 15 km, among South Korean skiers only, between 2002 and 2006?
470	Which country did tennis' first Golden Slam winner represent when they achieved it?
471	Which two MLB teams played in the World Series just weeks after the O.J. Simpson murder trial had ended?
472	Who was the Vice Admiral in charge of the Carrier Division the Japanese carrier Hiyō was in when she was sunk?
473	In January of 2024, how many colleges were in the district in which the William C. Davis Science building can be found?
474	Can you add one minute to the time of the title track from the album released by Ray Charles in the year before Phil Quartararo took over as president of its record label?
475	As of 2020, who is the longest-serving president of the university where Hannah Arendt is buried?
476	What was state of the schools regarding integration in the hometown of Miller Williams when he began his master's degree in Zoology?
477	Do zebra, giraffe or hippos wean the earliest?
478	How many years were there between Heath Ledger's birth and the first successful use of a special human extraction technology that appeared in a Batman movie that Ledger starred in?
479	How many feature films had James Cameron directed by the time Barack Obama was inaugurated as President of the United States?
480	Who was the president of the USA the year that the European Convention on Human Rights came into effect?
481	As of 1st November 2023, Which two South African drivers took part in the Formula One the year in which a micro-nation claimed territory off the coast of Suffolk, England?
482	How old was the first minister of the Ministry of Digital Affairs in Poland when Andrzej Halicki became minister?
483	Looking at the Best Actor and Best Actress categories for the 2023 Academy Awards, how many children did all of the winners and nominees have combined as of August 1, 2024?
484	Shakshouka and menemen are considered similar dishes. What two main ingredients do they have in common?
485	What is the title of the song that had the second highest record sales recorded on the Discography of American Historical Recordings in the same year that Fred J. Rath was elected mayor of Utica?
486	Give me the difference in time, measured in hours not days, between the first solo woman to thru-hike the Appalachian Trail and the fastest recorded solo woman to walk the Appalachian Trail before 2012.
487	If Mr. Rogers were still alive, how old would he have been when the movie "A Beautiful Day in the Neighborhood", featuring Tom Hanks came out in the U.S.?
488	Who became the prime minister of Canada in the same year that Jonathan Tremblay's re-election bid as representative for the electoral district of Montmorency—Charlevoix—Haute-Côte-Nord ended in defeat?
489	How many days after Peter Tosh died did Bunny Wailer pass away?
490	How old was Lucy Lawless when season six of Xena: Warrior Princess first aired?
491	Taylor Swift's debut single is named after another famous country singer. As of August 1, 2024, when is his wife's birthday?
492	What is the name of the rock climber/businessman who co-founded the environmental group that the co-founder of Netflix joined?
493	Meghan Markle's veil, worn at her 2018 wedding to Prince Harry, featured a flower for each Common Wealth country. What colour is the flower that was used to represent New Zealand?
494	How many years did it take after the FIFA ban was lifted for someone to wear a hijab in the World Cup?
495	What is the name of the lead role of the play that Harry C. Bradley's second wife was in, in 1906?
496	In the largest Northern City in California, the widow of a firearms magnate built a infamous mansion that became a tourist attraction only nine months after her death in the early 1900s. The mansion is not only a magnet for ghost hunters and horror story writers, but also architecture enthusiasts as the owner of the house spent 22 years constructing and adding on additional rooms and stairways and features to the already intricate mansion. The house at one point had 500 rooms, 10,000 windows, 47 fireplaces, and 6 kitchens. What exact date was this structure added to the U.S. National Register of Historic Places?
497	Fossils of the extinct sea snail, Alvania belgica, were originally found in a European country. What is the capital of that country?
