0	If my future wife has the same first name as the 15th first lady of the United States' mother and her surname is the same as the second assassinated president's mother's maiden name, what is my future wife's name?
1	Imagine there is a building called Bronte tower whose height in feet is the same number as the dewey decimal classification for the Charlotte Bronte book that was published in 1847. Where would this building rank among tallest buildings in New York City, as of August 2024?
2	How many years earlier would Punxsutawney Phil have to be canonically alive to have made a Groundhog Day prediction in the same state as the US capitol?
3	As of August 1, 2024, which country were holders of the FIFA World Cup the last time the UEFA Champions League was won by a club from London?
4	What is the name of the vocalist from the first band to make it in the top 200 under the record label that produced the third studio album for Dismal Euphony?
5	According to the 2000 United States census, what was the 2000 population of the birth city of the only 21st-century mayor of Austin, Texas who also served as mayor in the 1990s? Round your answer to the nearest thousand.
6	I have an element in mind and would like you to identify the person it was named after. Here's a clue: The element's atomic number is 9 higher than that of an element discovered by the scientist who discovered Zirconium in the same year.
7	As of Aug 3, 2024, the artist who released the album "Father of Asahd" went to the same high school as an Olympic diver. How many Olympic teams did this diver participate on?
8	A general motors vehicle is named after the largest ward in the country of Monaco.  How many people had walked on the moon as of the first model year of the vehicle? Note: the model year is not the same as the year the model was first produced.
9	The Pope born Pietro Barbo ended a long-running war two years after his papacy began, which famous conflict, immortalized in tapestry took place 400 years earlier?
