1020	Australasian Trees found in North America
1021	Plants from Texas and Panama
1022	Plant species that are from Oaxaca and the South-Central United States
1023	Monotypic angiosperm genera found in Jalisco.
1024	Flora of the North-Central United States that are Flora of the Klamath Mountains
1025	Ornamental trees from Coahuila
1026	Proteaceae plants from the Oceanian realm
1027	Poisonous trees of the United States
1028	Asterid genera that is used in Native American medicine.
1029	flora of norfolk island and indonesia
1030	Rubiaceae trees of western South America
1031	what are Trees of Australia that are also Malvales genera
1032	Western Indian Ocean plants and Trees in the Caribbean.
1033	Orchids of Belize that are also in Western South America
1034	Orchids of both North America and Cuba
1035	Bunchgrasses of southwestern Europe
1036	Trees of Western South American are also known as Flora of Oaxaca
1037	Drought-tolerant Flora of the Pacific
1038	Monotypic Poaceae plants of Indomalesia
1039	Carnivorous plants of Western canada
1040	Asterid genera of Socotra
1041	Plant species found in China and Romania
1042	Trees found in both Texas and Canada
1043	Freshwater plants
1044	Orchids of North America that are Flora of the Arctic
1045	Flora of Ecuador that is also in Jamaica
1046	Edible Trees of Mexico
1047	Flora of Yemen and egypt
1048	Flora of Macaronesia that are also found in Madagascar
1049	Trees that are found in South America and South-Central US
1050	Tree North-Central United States and Mexico have in common
1051	Tropical flora Caryophyllaceae genera
1052	Flora of Sierra Leone
1053	Brackish water plants that are from British Columbia
1054	what are Monotypic rosid genera that are also Flora of Madagascar
1055	Medicinal plants from South America used in traditional African medicine
1056	Flora from both British Columbia and Nuevo Leon.
1057	Ornamental trees found in the Russian Far East.
1058	Orchids of Cambodia that are also in Australia
1059	Flora of South America and the Central African Republic
1060	Papausia flora that is also Endemic flora of Indonesia
1061	Flora of Polynesia that are also Tropical fruit
1062	Ericales plants of the Great Lakes region
1063	Medicinal plants of Asia that are also found in the Russian Far East
1064	Bermuda Flora
1065	list of Orchids from Suriname
1066	Cucurbits that contain only one species
1067	Orchids from Mauritius.
1068	Monospecific screw-pine genera
1069	what are Flora of Tlaxcala
1070	Nigeria's orchids
1071	Plants that are only found in Samoa
1072	Ethiopia's trees
1073	what are some Crops originating from Pre-Columbian North America
1074	plant fossils
1075	Campeche trees
1076	genus of plants belonging to the family Cyclanthaceae
1077	South Sandwich Islands plant species.
1078	plants from Hinduism
1079	Plants that are Middle Devonian
1080	species of plant in the family Chloranthaceae
1081	Guinea-Bissau Flora
1082	orders of Red algae
1083	Endemic flora originated from Afghanistan
1084	what are Sacred trees in Hinduism
1085	Flora only found in Bulgaria.
1086	Flora that originates from the Maldives.
1087	Plants that are Cormous
1088	monocotyledonous
1089	Endemic flora from Guyana.
1090	plants that are low light
1091	Sri Lanka trees
1092	Monotypic Malvales genera
1093	what are the Monotypic plant orders
1094	Michoacán trees
1095	Amblystegiaceae species.
1096	all about Flowers
1097	Plants from São Tomé and Príncipe
1098	São Tomé and Príncipe endemic flora
1099	Types of plums
1100	Polytrichales
1101	France's orchids
1102	Plants in the Brassicales family
1103	what is a Hybrid prunus?
1104	Plants that are Oligocene
1105	Plants from the Poales family
1106	Plants native to Rodrigues
1107	Pacific origin crops
1108	Crops originating in Pakistan
1109	Korea's orchids
1110	Tabasco Trees.
1111	Plants that are only found in Lesotho.
1112	small succulent plants
1113	Families in Malvales
1114	Endemic orchids in Costa Rica
1115	Guizhou orchids
1116	angiosperms of the Cretaceous period
1117	Guanajuato trees
1118	Plants only found in the Juan Fernández Islands.
1119	State of Mexico plants
1120	Endemic flora from Papua New Guinea.
